{
  "name": "AWS SBG at Mysore University School of Engineering",
  "institution": "Mysore University School of Engineering",
  "shortName": "MUSE",
  "area": "Mysuru",
  "location": "Manasagangotri, Mysuru",
  "meetupUrl": "https://www.meetup.com/aws-sbg-at-mysore-university-school-of-engineering/",
  "order": 2
}
