{
  "name": "AWS SBG at Vidyavardhaka College of Engineering",
  "institution": "Vidyavardhaka College of Engineering",
  "shortName": "VVCE",
  "area": "Mysuru",
  "location": "Gokulam, Mysuru",
  "leader": "Yashwanth R",
  "meetupUrl": "https://www.meetup.com/aws-sbg-at-vidyavardhaka-college-of-engineering/",
  "order": 1
}
