{
  "name": "AWS SBG at G Madegowda Institute of Technology",
  "institution": "G Madegowda Institute of Technology",
  "shortName": "GMIT",
  "area": "Mandya",
  "location": "Mellahalli, Mandya",
  "leader": "Poorvika M",
  "meetupUrl": "https://www.meetup.com/aws-sbg-at-g-madegowda-institute-of-tech/",
  "order": 4
}
