{
  "name": "AWS SBG at Maharaja Inst of Technology - Thandavapura Campus",
  "institution": "Maharaja Institute of Technology, Thandavapura",
  "shortName": "MIT Thandavapura",
  "area": "Mysuru",
  "location": "Thandavapura, Mysuru",
  "leader": "Rakshitha",
  "meetupUrl": "https://www.meetup.com/aws-sbg-at-maharaja-inst-of-technology-thandavapura-campus/",
  "order": 3
}
